{
  "$schema": "https://json-schema.org/draft/2020-12/schema",
  "$id": "urn:steelmatter:proposed:permit:1",
  "title": "permit proposed unsigned payload",
  "type": "object",
  "properties": {
    "schema_version": {
      "const": "1"
    },
    "crypto_profile": {
      "const": "SM-JWS-ES256-1"
    },
    "permit_id": {
      "type": "string",
      "minLength": 1,
      "maxLength": 128,
      "pattern": "^[A-Za-z0-9][A-Za-z0-9._:-]*$"
    },
    "reservation_id": {
      "type": "string",
      "minLength": 1,
      "maxLength": 128,
      "pattern": "^[A-Za-z0-9][A-Za-z0-9._:-]*$"
    },
    "operation_id": {
      "type": "string",
      "minLength": 1,
      "maxLength": 128,
      "pattern": "^[A-Za-z0-9][A-Za-z0-9._:-]*$"
    },
    "tenant_id": {
      "type": "string",
      "minLength": 1,
      "maxLength": 128,
      "pattern": "^[A-Za-z0-9][A-Za-z0-9._:-]*$"
    },
    "instruction_id": {
      "type": "string",
      "minLength": 1,
      "maxLength": 128,
      "pattern": "^[A-Za-z0-9][A-Za-z0-9._:-]*$"
    },
    "action_revision": {
      "type": "integer",
      "minimum": 1,
      "maximum": 9007199254740991
    },
    "action_digest": {
      "type": "string",
      "pattern": "^[a-f0-9]{64}$"
    },
    "mandate_id": {
      "type": "string",
      "minLength": 1,
      "maxLength": 128,
      "pattern": "^[A-Za-z0-9][A-Za-z0-9._:-]*$"
    },
    "mandate_revision": {
      "type": "integer",
      "minimum": 1,
      "maximum": 9007199254740991
    },
    "mandate_digest": {
      "type": "string",
      "pattern": "^[a-f0-9]{64}$"
    },
    "control_epoch": {
      "type": "integer",
      "minimum": 1,
      "maximum": 9007199254740991
    },
    "actor_id": {
      "type": "string",
      "minLength": 1,
      "maxLength": 128,
      "pattern": "^[A-Za-z0-9][A-Za-z0-9._:-]*$"
    },
    "audience": {
      "type": "string",
      "minLength": 1,
      "maxLength": 128,
      "pattern": "^[A-Za-z0-9][A-Za-z0-9._:-]*$"
    },
    "currency": {
      "const": "INR"
    },
    "amount_minor": {
      "type": "integer",
      "minimum": 1,
      "maximum": 9007199254740991
    },
    "issued_at": {
      "type": "string",
      "format": "date-time",
      "pattern": "^\\d{4}-\\d{2}-\\d{2}T\\d{2}:\\d{2}:\\d{2}Z$"
    },
    "expires_at": {
      "type": "string",
      "format": "date-time",
      "pattern": "^\\d{4}-\\d{2}-\\d{2}T\\d{2}:\\d{2}:\\d{2}Z$"
    }
  },
  "required": [
    "schema_version",
    "crypto_profile",
    "permit_id",
    "reservation_id",
    "operation_id",
    "tenant_id",
    "instruction_id",
    "action_revision",
    "action_digest",
    "mandate_id",
    "mandate_revision",
    "mandate_digest",
    "control_epoch",
    "actor_id",
    "audience",
    "currency",
    "amount_minor",
    "issued_at",
    "expires_at"
  ],
  "additionalProperties": false
}
